{
  "local_tracks": [
    {
      "local_track_id": "local_track_001",
      "michi_track_id": "a1b2c3d4-e5f6-7890-abcd-ef1234567890",
      "content_hash": "sha256:a1b2c3d4e5f6a7b8c9d0e1f2a3b4c5d6e7f8a9b0c1d2e3f4a5b6c7d8e9f0a1b2",
      "file_size": 42345678,
      "duration_ms": 245000,
      "title": "Neon Lights",
      "artist": "Luna Swift",
      "album": "Imaginary Cities",
      "track_number": 1,
      "year": 2025,
      "format": "flac",
      "bitrate": 1411
    },
    {
      "local_track_id": "local_track_002",
      "michi_track_id": "b2c3d4e5-f6a7-8901-bcde-f12345678901",
      "content_hash": "sha256:b2c3d4e5f6a7b8c9d0e1f2a3b4c5d6e7f8a9b0c1d2e3f4a5b6c7d8e9f0a1b2c3",
      "file_size": 52345678,
      "duration_ms": 312000,
      "title": "Echoes in the Rain",
      "artist": "The Echoes",
      "album": "Neon Dreams",
      "track_number": 3,
      "year": 2024,
      "format": "flac",
      "bitrate": 1411
    }
  ],
  "queue": ["local_track_001", "local_track_002"],
  "current_index": 0,
  "position_ms": 45000,
  "playing": true,
  "volume": 80
}
